{
  "$schema": "../../../../schemas/v2/phase-b-package-manifest.schema.json",
  "schemaVersion": 1,
  "manifestVersion": "1.0.0",
  "packageId": "phase_b.muscles.head_orbit_face_tongue",
  "phase": "phase_b",
  "assetDomain": "muscles",
  "packageSequence": 1,
  "titleDe": "Muskeln – Kopf, Orbita, Gesicht, Zunge",
  "assignmentBasis": "working_asset_label",
  "assignmentStatus": "working_assignment_not_medically_verified",
  "reviewPriority": "standard",
  "expectedConceptCount": 36,
  "expectedInstanceCount": 72,
  "conceptIds": [
    "concept.soft_tissue.bucinator",
    "concept.soft_tissue.corrugator_supercilii",
    "concept.soft_tissue.deep_part_of_masseter",
    "concept.soft_tissue.depressor_anguli_oris",
    "concept.soft_tissue.depressor_labii_inferioris",
    "concept.soft_tissue.depressor_septi_nasi",
    "concept.soft_tissue.frontalis_muscle",
    "concept.soft_tissue.genioglossus_muscle",
    "concept.soft_tissue.hyoglossus_muscle",
    "concept.soft_tissue.inferior_head_of_lateral_pterygoid_muscle",
    "concept.soft_tissue.inferior_oblique_muscle",
    "concept.soft_tissue.inferior_rectus_muscle",
    "concept.soft_tissue.lateral_rectus_muscle",
    "concept.soft_tissue.levator_anguli_oris",
    "concept.soft_tissue.levator_labii_superioris",
    "concept.soft_tissue.levator_nasolabialis",
    "concept.soft_tissue.levator_palpebrae_superioris",
    "concept.soft_tissue.medial_pterygoid_muscle",
    "concept.soft_tissue.medial_rectus_muscle",
    "concept.soft_tissue.mentalis_muscle",
    "concept.soft_tissue.nasalis_muscle",
    "concept.soft_tissue.occipitalis_muscle",
    "concept.soft_tissue.orbicularis_oris_muscle",
    "concept.soft_tissue.orbital_part_of_orbicularis_oculi",
    "concept.soft_tissue.palatopharyngeus_muscle",
    "concept.soft_tissue.palpebral_part_of_orbicularis_oculi",
    "concept.soft_tissue.procerus_muscle",
    "concept.soft_tissue.risorius_muscle",
    "concept.soft_tissue.superficial_part_of_masseter",
    "concept.soft_tissue.superior_head_of_lateral_pterygoid_muscle",
    "concept.soft_tissue.superior_oblique_muscle",
    "concept.soft_tissue.superior_rectus_muscle",
    "concept.soft_tissue.temporalis_muscle",
    "concept.soft_tissue.temporoparietalis_muscle",
    "concept.soft_tissue.zygomaticus_major_muscle",
    "concept.soft_tissue.zygomaticus_minor_muscle"
  ],
  "stopTheLineConceptIds": []
}
