{
  "$schema": "../../../../schemas/v2/phase-b-package-manifest.schema.json",
  "schemaVersion": 1,
  "manifestVersion": "1.0.0",
  "packageId": "phase_b.skeleton.head_neck",
  "phase": "phase_b",
  "assetDomain": "skeleton",
  "packageSequence": 1,
  "titleDe": "Skelett – Kopf/Hals",
  "assignmentBasis": "working_asset_label",
  "assignmentStatus": "working_assignment_not_medically_verified",
  "reviewPriority": "standard",
  "expectedConceptCount": 44,
  "expectedInstanceCount": 76,
  "conceptIds": [
    "concept.skeleton.anterior_cells_of_ethmoid_bone",
    "concept.skeleton.arytenoid_cartilage",
    "concept.skeleton.corniculate_cartilage",
    "concept.skeleton.cricoid_cartilage",
    "concept.skeleton.ethmoid_bone",
    "concept.skeleton.frontal_bone",
    "concept.skeleton.hyoid_bone",
    "concept.skeleton.incus",
    "concept.skeleton.inferior_nasal_concha_bone",
    "concept.skeleton.lacrimal_bone",
    "concept.skeleton.lateral_process_of_nasal_septal_cartilage",
    "concept.skeleton.lower_canine",
    "concept.skeleton.lower_first_molar_tooth",
    "concept.skeleton.lower_first_premolar",
    "concept.skeleton.lower_lateral_incisor",
    "concept.skeleton.lower_medial_incisor",
    "concept.skeleton.lower_second_molar_tooth",
    "concept.skeleton.lower_second_premolar",
    "concept.skeleton.major_alar_cartilage",
    "concept.skeleton.malleus",
    "concept.skeleton.mandible",
    "concept.skeleton.maxilla",
    "concept.skeleton.middle_cells_of_ethmoid_bone",
    "concept.skeleton.nasal_bone",
    "concept.skeleton.nasal_septal_cartilage",
    "concept.skeleton.occipital_bone",
    "concept.skeleton.palatine_bone",
    "concept.skeleton.parietal_bone",
    "concept.skeleton.posterior_cells_of_ethmoid_bone",
    "concept.skeleton.sinus_of_frontal_bone",
    "concept.skeleton.sinus_of_sphenoid_bone",
    "concept.skeleton.sphenoid_bone",
    "concept.skeleton.stapes",
    "concept.skeleton.temporal_bone",
    "concept.skeleton.thyroid_cartilage",
    "concept.skeleton.upper_canine",
    "concept.skeleton.upper_first_molar_tooth",
    "concept.skeleton.upper_first_premolar",
    "concept.skeleton.upper_lateral_incisor",
    "concept.skeleton.upper_medial_incisor",
    "concept.skeleton.upper_second_molar_tooth",
    "concept.skeleton.upper_second_premolar",
    "concept.skeleton.vomer",
    "concept.skeleton.zygomatic_bone"
  ],
  "stopTheLineConceptIds": []
}
