{
  "$schema": "../../../../schemas/v2/phase-b-package-manifest.schema.json",
  "schemaVersion": 1,
  "manifestVersion": "1.0.0",
  "packageId": "phase_b.skeleton.spine",
  "phase": "phase_b",
  "assetDomain": "skeleton",
  "packageSequence": 2,
  "titleDe": "Skelett – Wirbelsäule",
  "assignmentBasis": "working_asset_label",
  "assignmentStatus": "working_assignment_not_medically_verified",
  "reviewPriority": "standard",
  "expectedConceptCount": 26,
  "expectedInstanceCount": 26,
  "conceptIds": [
    "concept.skeleton.atlas_c1",
    "concept.skeleton.axis_c2",
    "concept.skeleton.coccyx",
    "concept.skeleton.sacrum",
    "concept.skeleton.vertebra_c3",
    "concept.skeleton.vertebra_c4",
    "concept.skeleton.vertebra_c5",
    "concept.skeleton.vertebra_c6",
    "concept.skeleton.vertebra_c7",
    "concept.skeleton.vertebra_l1",
    "concept.skeleton.vertebra_l2",
    "concept.skeleton.vertebra_l3",
    "concept.skeleton.vertebra_l4",
    "concept.skeleton.vertebra_l5",
    "concept.skeleton.vertebra_t1",
    "concept.skeleton.vertebra_t10",
    "concept.skeleton.vertebra_t11",
    "concept.skeleton.vertebra_t12",
    "concept.skeleton.vertebra_t2",
    "concept.skeleton.vertebra_t3",
    "concept.skeleton.vertebra_t4",
    "concept.skeleton.vertebra_t5",
    "concept.skeleton.vertebra_t6",
    "concept.skeleton.vertebra_t7",
    "concept.skeleton.vertebra_t8",
    "concept.skeleton.vertebra_t9"
  ],
  "stopTheLineConceptIds": []
}
