{
  "$schema": "../../../../schemas/v2/phase-b-package-manifest.schema.json",
  "schemaVersion": 1,
  "manifestVersion": "1.0.0",
  "packageId": "phase_b.muscles.thorax_abdomen_pelvic_floor",
  "phase": "phase_b",
  "assetDomain": "muscles",
  "packageSequence": 4,
  "titleDe": "Muskeln – Thorax, Abdomen, Beckenboden",
  "assignmentBasis": "working_asset_label",
  "assignmentStatus": "working_assignment_not_medically_verified",
  "reviewPriority": "standard",
  "expectedConceptCount": 24,
  "expectedInstanceCount": 47,
  "conceptIds": [
    "concept.soft_tissue.abdominal_part_of_pectoralis_major_muscle",
    "concept.soft_tissue.clavicular_head_of_pectoralis_major_muscle",
    "concept.soft_tissue.coccygeus_muscle",
    "concept.soft_tissue.diaphragm",
    "concept.soft_tissue.external_abdominal_oblique_muscle",
    "concept.soft_tissue.external_anal_sphincter",
    "concept.soft_tissue.external_intercostal_muscles",
    "concept.soft_tissue.iliococcygeus_muscle",
    "concept.soft_tissue.innermost_intercostal_muscles",
    "concept.soft_tissue.internal_abdominal_oblique_muscle",
    "concept.soft_tissue.internal_intercostal_muscles",
    "concept.soft_tissue.levatores_breves_costarum",
    "concept.soft_tissue.levatores_longi_costarum",
    "concept.soft_tissue.pectoralis_minor_muscle",
    "concept.soft_tissue.pubo_analis_muscle",
    "concept.soft_tissue.pubococcygeus_muscle",
    "concept.soft_tissue.pyramidalis_muscle",
    "concept.soft_tissue.quadratus_lumborum_muscle",
    "concept.soft_tissue.rectus_abdominis_muscle",
    "concept.soft_tissue.serratus_anterior_muscle",
    "concept.soft_tissue.sternocostal_head_of_pectoralis_major_muscle",
    "concept.soft_tissue.subclavius_muscle",
    "concept.soft_tissue.transversus_abdominis_muscle",
    "concept.soft_tissue.transversus_thoracis_muscle"
  ],
  "stopTheLineConceptIds": []
}
