{
  "$schema": "../../../../schemas/v2/phase-b-package-manifest.schema.json",
  "schemaVersion": 1,
  "manifestVersion": "1.0.0",
  "packageId": "phase_b.connective_tissue.fasciae_arches_septa_tract",
  "phase": "phase_b",
  "assetDomain": "connective_tissue",
  "packageSequence": 1,
  "titleDe": "Bindegewebe – Faszien, Faszienbögen, Septa und Faszienzug",
  "assignmentBasis": "working_asset_label",
  "assignmentStatus": "working_assignment_not_medically_verified",
  "reviewPriority": "stop_the_line_first",
  "expectedConceptCount": 31,
  "expectedInstanceCount": 59,
  "conceptIds": [
    "concept.soft_tissue.antebrachial_fascia",
    "concept.soft_tissue.anterior_intermuscular_septum_of_leg",
    "concept.soft_tissue.anterior_layer_of_thoracolumbar_fascia",
    "concept.soft_tissue.brachial_fascia",
    "concept.soft_tissue.clavipectoral_fascia",
    "concept.soft_tissue.crural_fascia",
    "concept.soft_tissue.deltoid_fascia",
    "concept.soft_tissue.diaphragmatic_fascia",
    "concept.soft_tissue.dorsal_fascia_of_hand",
    "concept.soft_tissue.fascia_lata",
    "concept.soft_tissue.iliopectineal_arch",
    "concept.soft_tissue.iliopsoas_fascia",
    "concept.soft_tissue.iliotibial_tract",
    "concept.soft_tissue.investing_abdominal_fascia",
    "concept.soft_tissue.lateral_femoral_intermuscular_septum",
    "concept.soft_tissue.lateral_intermuscular_septum_of_arm",
    "concept.soft_tissue.linea_alba",
    "concept.soft_tissue.masseteric_fascia",
    "concept.soft_tissue.medial_femoral_intermuscular_septum",
    "concept.soft_tissue.medial_intermuscular_septum_of_arm",
    "concept.soft_tissue.middle_layer_of_thoracolumbar_fascia",
    "concept.soft_tissue.pectoral_fascia",
    "concept.soft_tissue.piriformis_fascia",
    "concept.soft_tissue.popliteal_fascia",
    "concept.soft_tissue.posterior_intermuscular_septum_of_leg",
    "concept.soft_tissue.posterior_layer_of_thoracolumbar_fascia",
    "concept.soft_tissue.superficial_investing_cervical_fascia",
    "concept.soft_tissue.superficial_layer_of_temporal_fascia",
    "concept.soft_tissue.tendinous_arch_of_levator_ani",
    "concept.soft_tissue.transversalis_fascia",
    "concept.soft_tissue.transverse_intermuscular_septum_of_leg"
  ],
  "stopTheLineConceptIds": [
    "concept.soft_tissue.iliopsoas_fascia"
  ]
}
