{
  "$schema": "../../../../schemas/v2/phase-b-package-manifest.schema.json",
  "schemaVersion": 1,
  "manifestVersion": "1.0.0",
  "packageId": "phase_b.muscles.lower_leg_foot",
  "phase": "phase_b",
  "assetDomain": "muscles",
  "packageSequence": 8,
  "titleDe": "Muskeln – Unterschenkel/Fuß",
  "assignmentBasis": "working_asset_label",
  "assignmentStatus": "working_assignment_not_medically_verified",
  "reviewPriority": "standard",
  "expectedConceptCount": 29,
  "expectedInstanceCount": 58,
  "conceptIds": [
    "concept.soft_tissue.abductor_digiti_minimi_of_foot",
    "concept.soft_tissue.abductor_hallucis",
    "concept.soft_tissue.dorsal_interossei_muscles_of_foot",
    "concept.soft_tissue.extensor_digitorum_brevis",
    "concept.soft_tissue.extensor_digitorum_longus",
    "concept.soft_tissue.extensor_hallucis_brevis",
    "concept.soft_tissue.extensor_hallucis_longus",
    "concept.soft_tissue.fibularis_brevis_muscle",
    "concept.soft_tissue.fibularis_longus_muscle",
    "concept.soft_tissue.fibularis_tertius_muscle",
    "concept.soft_tissue.flexor_digiti_minimi_of_foot",
    "concept.soft_tissue.flexor_digitorum_brevis",
    "concept.soft_tissue.flexor_digitorum_longus",
    "concept.soft_tissue.flexor_hallucis_longus",
    "concept.soft_tissue.lateral_head_of_flexor_hallucis_brevis",
    "concept.soft_tissue.lateral_head_of_gastrocnemius",
    "concept.soft_tissue.lumbrical_muscles_of_foot",
    "concept.soft_tissue.medial_head_of_flexor_hallucis_brevis",
    "concept.soft_tissue.medial_head_of_gastrocnemius",
    "concept.soft_tissue.oblique_head_of_adductor_hallucis",
    "concept.soft_tissue.opponens_digiti_minimi_muscle_of_foot",
    "concept.soft_tissue.plantar_interossei_muscles",
    "concept.soft_tissue.plantaris_muscle",
    "concept.soft_tissue.popliteus_muscle",
    "concept.soft_tissue.quadratus_plantae_muscle",
    "concept.soft_tissue.soleus_muscle",
    "concept.soft_tissue.tibialis_anterior_muscle",
    "concept.soft_tissue.tibialis_posterior_muscle",
    "concept.soft_tissue.transverse_head_of_adductor_hallucis"
  ],
  "stopTheLineConceptIds": []
}
