{
  "$schema": "../../../../schemas/v2/phase-b-package-manifest.schema.json",
  "schemaVersion": 1,
  "manifestVersion": "1.0.0",
  "packageId": "phase_b.skeleton.upper_extremity",
  "phase": "phase_b",
  "assetDomain": "skeleton",
  "packageSequence": 4,
  "titleDe": "Skelett – obere Extremität",
  "assignmentBasis": "working_asset_label",
  "assignmentStatus": "working_assignment_not_medically_verified",
  "reviewPriority": "standard",
  "expectedConceptCount": 32,
  "expectedInstanceCount": 64,
  "conceptIds": [
    "concept.skeleton.capitate_bone",
    "concept.skeleton.clavicle",
    "concept.skeleton.distal_phalanx_of_fifth_finger_of_hand",
    "concept.skeleton.distal_phalanx_of_first_finger_of_hand",
    "concept.skeleton.distal_phalanx_of_fourth_finger_of_hand",
    "concept.skeleton.distal_phalanx_of_second_finger_of_hand",
    "concept.skeleton.distal_phalanx_of_third_finger_of_hand",
    "concept.skeleton.fifth_metacarpal_bone",
    "concept.skeleton.first_metacarpal_bone",
    "concept.skeleton.fourth_metacarpal_bone",
    "concept.skeleton.hamate_bone",
    "concept.skeleton.humerus",
    "concept.skeleton.lunate_bone",
    "concept.skeleton.middle_phalanx_of_fifth_finger_of_hand",
    "concept.skeleton.middle_phalanx_of_fourth_finger_of_hand",
    "concept.skeleton.middle_phalanx_of_second_finger_of_hand",
    "concept.skeleton.middle_phalanx_of_third_finger_of_hand",
    "concept.skeleton.pisiform_bone",
    "concept.skeleton.proximal_phalanx_of_fifth_finger_of_hand",
    "concept.skeleton.proximal_phalanx_of_first_finger_of_hand",
    "concept.skeleton.proximal_phalanx_of_fourth_finger_of_hand",
    "concept.skeleton.proximal_phalanx_of_second_finger_of_hand",
    "concept.skeleton.proximal_phalanx_of_third_finger_of_hand",
    "concept.skeleton.radius",
    "concept.skeleton.scaphoid_bone",
    "concept.skeleton.scapula",
    "concept.skeleton.second_metacarpal_bone",
    "concept.skeleton.third_metacarpal_bone",
    "concept.skeleton.trapezium_bone",
    "concept.skeleton.trapezoid_bone",
    "concept.skeleton.triquetrum_bone",
    "concept.skeleton.ulna"
  ],
  "stopTheLineConceptIds": []
}
