{
  "$schema": "../../../../schemas/v2/phase-b-package-manifest.schema.json",
  "schemaVersion": 1,
  "manifestVersion": "1.0.0",
  "packageId": "phase_b.skeleton.thorax",
  "phase": "phase_b",
  "assetDomain": "skeleton",
  "packageSequence": 3,
  "titleDe": "Skelett – Thorax",
  "assignmentBasis": "working_asset_label",
  "assignmentStatus": "working_assignment_not_medically_verified",
  "reviewPriority": "standard",
  "expectedConceptCount": 25,
  "expectedInstanceCount": 47,
  "conceptIds": [
    "concept.skeleton.body_of_sternum",
    "concept.skeleton.costal_cartilage_of_eighth_rib",
    "concept.skeleton.costal_cartilage_of_fifth_rib",
    "concept.skeleton.costal_cartilage_of_first_rib",
    "concept.skeleton.costal_cartilage_of_fourth_rib",
    "concept.skeleton.costal_cartilage_of_ninth_rib",
    "concept.skeleton.costal_cartilage_of_second_rib",
    "concept.skeleton.costal_cartilage_of_seventh_rib",
    "concept.skeleton.costal_cartilage_of_sixth_rib",
    "concept.skeleton.costal_cartilage_of_tenth_rib",
    "concept.skeleton.costal_cartilage_of_third_rib",
    "concept.skeleton.eighth_rib",
    "concept.skeleton.eleventh_rib",
    "concept.skeleton.fifth_rib",
    "concept.skeleton.first_rib",
    "concept.skeleton.fourth_rib",
    "concept.skeleton.manubrium_of_sternum",
    "concept.skeleton.ninth_rib",
    "concept.skeleton.second_rib",
    "concept.skeleton.seventh_rib",
    "concept.skeleton.sixth_rib",
    "concept.skeleton.tenth_rib",
    "concept.skeleton.third_rib",
    "concept.skeleton.twelfth_rib",
    "concept.skeleton.xiphoid_process"
  ],
  "stopTheLineConceptIds": []
}
