{
  "$schema": "../../../../schemas/v2/phase-b-package-manifest.schema.json",
  "schemaVersion": 1,
  "manifestVersion": "1.0.0",
  "packageId": "phase_b.muscles.back",
  "phase": "phase_b",
  "assetDomain": "muscles",
  "packageSequence": 3,
  "titleDe": "Muskeln – Rücken",
  "assignmentBasis": "working_asset_label",
  "assignmentStatus": "working_assignment_not_medically_verified",
  "reviewPriority": "stop_the_line_first",
  "expectedConceptCount": 35,
  "expectedInstanceCount": 70,
  "conceptIds": [
    "concept.soft_tissue.ascending_part_of_trapezius_muscle",
    "concept.soft_tissue.descending_part_of_trapezius_muscle",
    "concept.soft_tissue.dorsal_parts_of_lateral_intertransversarii_lumborum_muscles",
    "concept.soft_tissue.iliocostalis_colli_muscle",
    "concept.soft_tissue.iliocostalis_lumborum_muscle",
    "concept.soft_tissue.iliocostalis_thoracis_muscle",
    "concept.soft_tissue.interspinales_colli_muscles",
    "concept.soft_tissue.interspinales_lumborum_muscles",
    "concept.soft_tissue.interspinales_thoracis_muscles",
    "concept.soft_tissue.latissimus_dorsi_muscle",
    "concept.soft_tissue.levator_scapulae",
    "concept.soft_tissue.longissimus_capitis_muscle",
    "concept.soft_tissue.longissimus_colli_muscle",
    "concept.soft_tissue.longissimus_thoracis_muscle",
    "concept.soft_tissue.multifidus_colli_muscle",
    "concept.soft_tissue.multifidus_lumborum_muscle",
    "concept.soft_tissue.multifidus_thoracis_muscle",
    "concept.soft_tissue.obliquus_inferior_capitis_muscle",
    "concept.soft_tissue.obliquus_superior_capitis_muscle",
    "concept.soft_tissue.rectus_posterior_major_capitis_muscle",
    "concept.soft_tissue.rectus_posterior_minor_capitis_muscle",
    "concept.soft_tissue.rhomboid_major_muscle",
    "concept.soft_tissue.rhomboid_minor_muscle",
    "concept.soft_tissue.rotatores",
    "concept.soft_tissue.semispinalis_colli_muscle",
    "concept.soft_tissue.semispinalis_thoracis_muscle",
    "concept.soft_tissue.serratus_posterior_inferior_muscle",
    "concept.soft_tissue.serratus_posterior_superior_muscle",
    "concept.soft_tissue.spinalis_capitis_muscle",
    "concept.soft_tissue.spinalis_colli_muscle",
    "concept.soft_tissue.spinalis_thoracis_muscle",
    "concept.soft_tissue.splenius_capitis_muscle",
    "concept.soft_tissue.splenius_colli_muscle",
    "concept.soft_tissue.transverse_part_of_trapezius_muscle",
    "concept.soft_tissue.ventral_parts_of_lateral_intertransversarii_lumborum_muscles"
  ],
  "stopTheLineConceptIds": [
    "concept.soft_tissue.iliocostalis_colli_muscle"
  ]
}
