{
  "$schema": "../../../../schemas/v2/phase-b-package-manifest.schema.json",
  "schemaVersion": 1,
  "manifestVersion": "1.0.0",
  "packageId": "phase_b.skeleton.pelvis_lower_extremity",
  "phase": "phase_b",
  "assetDomain": "skeleton",
  "packageSequence": 5,
  "titleDe": "Skelett – Becken/untere Extremität",
  "assignmentBasis": "working_asset_label",
  "assignmentStatus": "working_assignment_not_medically_verified",
  "reviewPriority": "standard",
  "expectedConceptCount": 32,
  "expectedInstanceCount": 64,
  "conceptIds": [
    "concept.skeleton.calcaneus",
    "concept.skeleton.cuboid_bone",
    "concept.skeleton.distal_phalanx_of_fifth_finger_of_foot",
    "concept.skeleton.distal_phalanx_of_first_finger_of_foot",
    "concept.skeleton.distal_phalanx_of_fourth_finger_of_foot",
    "concept.skeleton.distal_phalanx_of_second_finger_of_foot",
    "concept.skeleton.distal_phalanx_of_third_finger_of_foot",
    "concept.skeleton.femur",
    "concept.skeleton.fibula",
    "concept.skeleton.fifth_metatarsal_bone",
    "concept.skeleton.first_metatarsal_bone",
    "concept.skeleton.fourth_metatarsal_bone",
    "concept.skeleton.hip_bone",
    "concept.skeleton.intermediate_cuneiform_bone",
    "concept.skeleton.lateral_cuneiform_bone",
    "concept.skeleton.medial_cuneiform_bone",
    "concept.skeleton.middle_phalanx_of_fifth_finger_of_foot",
    "concept.skeleton.middle_phalanx_of_fourth_finger_of_foot",
    "concept.skeleton.middle_phalanx_of_second_finger_of_foot",
    "concept.skeleton.middle_phalanx_of_third_finger_of_foot",
    "concept.skeleton.navicular_bone",
    "concept.skeleton.patella",
    "concept.skeleton.proximal_phalanx_of_fifth_finger_of_foot",
    "concept.skeleton.proximal_phalanx_of_first_finger_of_foot",
    "concept.skeleton.proximal_phalanx_of_fourth_finger_of_foot",
    "concept.skeleton.proximal_phalanx_of_second_finger_of_foot",
    "concept.skeleton.proximal_phalanx_of_third_finger_of_foot",
    "concept.skeleton.second_metatarsal_bone",
    "concept.skeleton.sesamoid_bones_of_foot",
    "concept.skeleton.talus",
    "concept.skeleton.third_metatarsal_bone",
    "concept.skeleton.tibia"
  ],
  "stopTheLineConceptIds": []
}
