{
  "$schema": "../../../../schemas/v2/phase-b-package-manifest.schema.json",
  "schemaVersion": 1,
  "manifestVersion": "1.0.0",
  "packageId": "phase_b.muscles.hip_thigh",
  "phase": "phase_b",
  "assetDomain": "muscles",
  "packageSequence": 7,
  "titleDe": "Muskeln – Hüfte/Oberschenkel",
  "assignmentBasis": "working_asset_label",
  "assignmentStatus": "working_assignment_not_medically_verified",
  "reviewPriority": "standard",
  "expectedConceptCount": 27,
  "expectedInstanceCount": 54,
  "conceptIds": [
    "concept.soft_tissue.adductor_brevis",
    "concept.soft_tissue.adductor_longus",
    "concept.soft_tissue.adductor_magnus",
    "concept.soft_tissue.adductor_minimus",
    "concept.soft_tissue.gluteus_maximus_muscle",
    "concept.soft_tissue.gluteus_medius_muscle",
    "concept.soft_tissue.gluteus_minimus_muscle",
    "concept.soft_tissue.gracilis_muscle",
    "concept.soft_tissue.iliacus_muscle",
    "concept.soft_tissue.inferior_gemellus_muscle",
    "concept.soft_tissue.long_head_of_biceps_femoris",
    "concept.soft_tissue.obturator_externus",
    "concept.soft_tissue.obturator_internus",
    "concept.soft_tissue.pectineus_muscle",
    "concept.soft_tissue.piriformis_muscle",
    "concept.soft_tissue.psoas_major",
    "concept.soft_tissue.quadratus_femoris_muscle",
    "concept.soft_tissue.rectus_femoris_muscle",
    "concept.soft_tissue.sartorius_muscle",
    "concept.soft_tissue.semimembranosus_muscle",
    "concept.soft_tissue.semitendinosus_muscle",
    "concept.soft_tissue.short_head_of_biceps_femoris",
    "concept.soft_tissue.superior_gemellus_muscle",
    "concept.soft_tissue.tensor_fasciae_latae",
    "concept.soft_tissue.vastus_intermedius_muscle",
    "concept.soft_tissue.vastus_lateralis_muscle",
    "concept.soft_tissue.vastus_medialis_muscle"
  ],
  "stopTheLineConceptIds": []
}
