{
  "$schema": "../../../../schemas/v2/phase-b-package-manifest.schema.json",
  "schemaVersion": 1,
  "manifestVersion": "1.0.0",
  "packageId": "phase_b.connective_tissue.lower_extremity_bursae_sheaths",
  "phase": "phase_b",
  "assetDomain": "connective_tissue",
  "packageSequence": 3,
  "titleDe": "Bindegewebe – untere Extremität: Bursen und Sehnenscheiden",
  "assignmentBasis": "working_asset_label",
  "assignmentStatus": "working_assignment_not_medically_verified",
  "reviewPriority": "stop_the_line_first",
  "expectedConceptCount": 37,
  "expectedInstanceCount": 74,
  "conceptIds": [
    "concept.soft_tissue.anserine_bursa",
    "concept.soft_tissue.bursa_of_piriformis_muscle",
    "concept.soft_tissue.common_tendon_sheath_of_fibularis_muscles",
    "concept.soft_tissue.deep_infrapatellar_bursa",
    "concept.soft_tissue.iliopectineal_bursa",
    "concept.soft_tissue.inferior_subtendinous_bursa_of_biceps_femoris_muscle",
    "concept.soft_tissue.intermuscular_gluteal_bursae",
    "concept.soft_tissue.lateral_subtendinous_bursa_of_gastrocnemius_muscle",
    "concept.soft_tissue.medial_subtendinous_bursa_of_gastrocnemius_muscle",
    "concept.soft_tissue.plantar_tendon_sheath_of_fibularis_longus_muscle",
    "concept.soft_tissue.sciatic_bursa_of_gluteus_maximus_muscle",
    "concept.soft_tissue.sciatic_bursa_of_obturator_internus",
    "concept.soft_tissue.semimembranosus_bursa",
    "concept.soft_tissue.subcutaneous_bursa_of_lateral_malleolus",
    "concept.soft_tissue.subcutaneous_bursa_of_medial_malleolus",
    "concept.soft_tissue.subcutaneous_bursa_of_tuberosity_of_tibia",
    "concept.soft_tissue.subcutaneous_calcaneal_bursa",
    "concept.soft_tissue.subcutaneous_infrapatellar_bursa",
    "concept.soft_tissue.subcutaneous_prepatellar_bursa",
    "concept.soft_tissue.subcutaneous_trochanteric_bursa",
    "concept.soft_tissue.subfacial_prepatellar_bursa",
    "concept.soft_tissue.subtendinous_bursa_of_iliacus_muscle",
    "concept.soft_tissue.subtendinous_bursa_of_obturator_internus",
    "concept.soft_tissue.subtendinous_bursa_of_sartorius_muscle",
    "concept.soft_tissue.subtendinous_bursa_of_tibialis_anterior",
    "concept.soft_tissue.subtendinous_calcaneal_bursa",
    "concept.soft_tissue.subtendinous_prepatellar_bursa",
    "concept.soft_tissue.superior_bursa_of_biceps_femoris_muscle",
    "concept.soft_tissue.suprapatellar_bursa",
    "concept.soft_tissue.tendon_sheath_of_extensor_digitorum_longus",
    "concept.soft_tissue.tendon_sheath_of_flexor_digitorum_longus",
    "concept.soft_tissue.tendon_sheath_of_flexor_hallucis_longus",
    "concept.soft_tissue.tendon_sheath_of_tibialis_anterior",
    "concept.soft_tissue.tendon_sheath_of_tibialis_posterior_muscle",
    "concept.soft_tissue.trochanteric_bursa_of_gluteus_maximus_muscle",
    "concept.soft_tissue.trochanteric_bursa_of_gluteus_medius_muscle",
    "concept.soft_tissue.trochanteric_bursa_of_gluteus_minimus_muscle"
  ],
  "stopTheLineConceptIds": [
    "concept.soft_tissue.trochanteric_bursa_of_gluteus_medius_muscle"
  ]
}
