{
  "$schema": "../../../../schemas/v2/phase-b-package-manifest.schema.json",
  "schemaVersion": 1,
  "manifestVersion": "1.0.0",
  "packageId": "phase_b.muscles.neck_pharynx_larynx",
  "phase": "phase_b",
  "assetDomain": "muscles",
  "packageSequence": 2,
  "titleDe": "Muskeln – Hals, Pharynx, Larynx",
  "assignmentBasis": "working_asset_label",
  "assignmentStatus": "working_assignment_not_medically_verified",
  "reviewPriority": "standard",
  "expectedConceptCount": 30,
  "expectedInstanceCount": 59,
  "conceptIds": [
    "concept.soft_tissue.anterior_belly_of_digastric_muscle",
    "concept.soft_tissue.ary_epiglottic_part_of_oblique_arytenoid_muscle",
    "concept.soft_tissue.external_part_of_thyro_arytenoid_muscle",
    "concept.soft_tissue.geniohyoid_muscle",
    "concept.soft_tissue.inferior_pharyngeal_constrictor",
    "concept.soft_tissue.lateral_crico_arytenoid_muscle",
    "concept.soft_tissue.longus_capitis_muscle",
    "concept.soft_tissue.longus_colli_muscle",
    "concept.soft_tissue.middle_pharyngeal_constrictor",
    "concept.soft_tissue.mylohyoid_muscle",
    "concept.soft_tissue.oblique_part_of_cricothyroid_muscle",
    "concept.soft_tissue.omohyoid_muscle",
    "concept.soft_tissue.platysma",
    "concept.soft_tissue.posterior_belly_of_digastric_muscle",
    "concept.soft_tissue.posterior_crico_arytenoid_muscle",
    "concept.soft_tissue.rectus_anterior_capitis_muscle",
    "concept.soft_tissue.rectus_lateralis_capitis_muscle",
    "concept.soft_tissue.scalenus_anterior_muscle",
    "concept.soft_tissue.scalenus_medius_muscle",
    "concept.soft_tissue.scalenus_posterior_muscle",
    "concept.soft_tissue.sternocleidomastoid_muscle",
    "concept.soft_tissue.sternohyoid_muscle",
    "concept.soft_tissue.sternothyroid_muscle",
    "concept.soft_tissue.straight_part_of_cricothyroid_muscle",
    "concept.soft_tissue.stylohyoid_muscle",
    "concept.soft_tissue.stylopharyngeus_muscle",
    "concept.soft_tissue.superior_pharyngeal_constrictor",
    "concept.soft_tissue.thyro_epiglottic_part_of_thyro_arytenoid_muscle",
    "concept.soft_tissue.thyrohyoid_muscle",
    "concept.soft_tissue.transverse_arytenoid_muscle"
  ],
  "stopTheLineConceptIds": []
}
