{
  "$schema": "../../../../schemas/v2/phase-b-package-manifest.schema.json",
  "schemaVersion": 1,
  "manifestVersion": "1.0.0",
  "packageId": "phase_b.muscles.forearm_hand",
  "phase": "phase_b",
  "assetDomain": "muscles",
  "packageSequence": 6,
  "titleDe": "Muskeln – Unterarm/Hand",
  "assignmentBasis": "working_asset_label",
  "assignmentStatus": "working_assignment_not_medically_verified",
  "reviewPriority": "standard",
  "expectedConceptCount": 36,
  "expectedInstanceCount": 72,
  "conceptIds": [
    "concept.soft_tissue.abductor_digiti_minimi_of_hand",
    "concept.soft_tissue.abductor_pollicis_brevis",
    "concept.soft_tissue.abductor_pollicis_longus",
    "concept.soft_tissue.anconeus_muscle",
    "concept.soft_tissue.brachioradialis_muscle",
    "concept.soft_tissue.deep_head_of_flexor_pollicis_brevis",
    "concept.soft_tissue.deep_head_of_pronator_teres",
    "concept.soft_tissue.dorsal_interossei_muscles_of_hand",
    "concept.soft_tissue.extensor_carpi_radialis_brevis",
    "concept.soft_tissue.extensor_carpi_radialis_longus",
    "concept.soft_tissue.extensor_digiti_minimi",
    "concept.soft_tissue.extensor_digitorum",
    "concept.soft_tissue.extensor_indicis",
    "concept.soft_tissue.extensor_pollicis_brevis",
    "concept.soft_tissue.extensor_pollicis_longus",
    "concept.soft_tissue.flexor_carpi_radialis",
    "concept.soft_tissue.flexor_digiti_minimi_of_hand",
    "concept.soft_tissue.flexor_digitorum_profundus",
    "concept.soft_tissue.flexor_pollicis_longus",
    "concept.soft_tissue.humeral_head_of_extensor_carpi_ulnaris",
    "concept.soft_tissue.humeral_head_of_flexor_carpi_ulnaris",
    "concept.soft_tissue.humero_ulnar_head_of_flexor_digitorum_superficialis",
    "concept.soft_tissue.lumbrical_muscles_of_hand",
    "concept.soft_tissue.oblique_head_of_adductor_pollicis",
    "concept.soft_tissue.opponens_digiti_minimi_muscle_of_hand",
    "concept.soft_tissue.opponens_pollicis_muscle",
    "concept.soft_tissue.palmar_interossei_muscles",
    "concept.soft_tissue.palmaris_longus_muscle",
    "concept.soft_tissue.pronator_quadratus",
    "concept.soft_tissue.radial_head_of_flexor_digitorum_superficialis",
    "concept.soft_tissue.superficial_head_of_flexor_pollicis_brevis",
    "concept.soft_tissue.superficial_head_of_pronator_teres",
    "concept.soft_tissue.supinator",
    "concept.soft_tissue.transverse_head_of_adductor_pollicis",
    "concept.soft_tissue.ulnar_head_of_extensor_carpi_ulnaris",
    "concept.soft_tissue.ulnar_head_of_flexor_carpi_ulnaris"
  ],
  "stopTheLineConceptIds": []
}
